{
  "$schema": "./stage0-acceptance.schema.json",
  "schemaVersion": 1,
  "stage": "stage0",
  "status": "PROVISIONAL",
  "generatedAt": "2026-08-23T00:00:00Z",
  "repositories": {
    "backend": {
      "repository": "Zhi-Hua-Yuan/LearningManage",
      "branch": "develop",
      "sha": "5a8a2a42208b33655b34b5f4e95909ec5a062b92"
    },
    "frontend": {
      "repository": "Zhi-Hua-Yuan/learning-manage-frontend",
      "branch": "develop",
      "sha": "cdff8f777843ab18f0c01c08d5f2ac7a82ec23e9"
    }
  },
  "sourceMatrix": "docs/stage0/acceptance/stage0-acceptance-matrix-2026-08-23.md",
  "gates": [
    {"id":"E0-01","domain":"工程基线","status":"PASS","criteria":"工程基线、运行环境和范围边界已记录","evidence":["docs/stage0/baseline/README.md"]},
    {"id":"E0-02","domain":"数据质量","status":"PASS","criteria":"主库审计、修复演练和修复结果可追溯","evidence":["docs/stage0/database-audit/data-quality-report.md","docs/stage0/database-audit/main-repair-execution-2026-08-17.md"]},
    {"id":"E0-03","domain":"凭据清理","status":"PASS","criteria":"应用配置不默认使用 Root，敏感配置通过环境变量注入","evidence":["docs/stage0/security/README.md"]},
    {"id":"E0-04","domain":"账号隔离","status":"PASS","criteria":"应用、测试和 Flyway 迁移账号独立，业务账号无 DDL","evidence":["docs/stage0/security/b2-1-account-creation-2026-08-18.md","docs/stage0/ci/pr6-d2-c-full-stack-ai-gate-2026-08-22.md"]},
    {"id":"E0-05","domain":"密钥轮换","status":"PASS","criteria":"JWT 和阿里云 Key 按 B2 记录完成处理","evidence":["docs/stage0/security/b2-3-jwt-rotation-2026-08-18.md","docs/stage0/security/b2-4-aliyun-api-key-2026-08-19.md"]},
    {"id":"E0-06","domain":"MySQL Root","status":"ACCEPTED_RISK","criteria":"本机 Root 密码未轮换，风险已限定并接受","evidence":["docs/stage0/security/b2-5-mysql-root-rotation-waiver-2026-08-19.md"]},
    {"id":"E0-07","domain":"Redis","status":"DEFERRED","criteria":"Redis 5 认证/ACL 方案延期，不纳入本阶段","evidence":["docs/stage0/security/README.md"]},
    {"id":"E0-08","domain":"Qdrant","status":"NOT_APPLICABLE","criteria":"当前无 Qdrant 代码调用方","evidence":["docs/stage0/security/credential-inventory-2026-08-18.md"]},
    {"id":"E0-09","domain":"Flyway V1","status":"PASS","criteria":"V1 可从空库安装且已发布迁移不可修改","evidence":["docs/stage0/flyway/v1-design.md","docs/stage0/flyway/README.md"]},
    {"id":"E0-10","domain":"存量库升级","status":"PASS","criteria":"存量数据库 baseline/升级门禁成功","evidence":["docs/stage0/flyway/pr3-existing-db-baseline-rehearsal-2026-08-19.md","docs/stage0/flyway/pr5-b-main-baseline-execution-2026-08-20.md"]},
    {"id":"E0-11","domain":"主库接管","status":"PASS","criteria":"主库只完成授权的 V1 baseline，未重复迁移","evidence":["docs/stage0/flyway/pr5-b-main-baseline-execution-2026-08-20.md"]},
    {"id":"E0-12","domain":"后端 CI","status":"PASS","criteria":"5 项后端必需检查通过","evidence":["docs/stage0/ci/pr6-b3-backend-github-actions-2026-08-21.md"]},
    {"id":"E0-13","domain":"前端 CI","status":"PASS","criteria":"3 项前端必需检查通过","evidence":["docs/stage0/ci/pr6-b4-branch-protection-2026-08-21.md"]},
    {"id":"E0-14","domain":"分支保护","status":"PASS","criteria":"两个 develop 必须 PR 合并，禁止删除和强推","evidence":["docs/stage0/ci/rulesets/protect-develop-v1.json"]},
    {"id":"E0-15","domain":"跨仓候选","status":"PASS","criteria":"精确 SHA 冻结、候选期间分支不变、Manifest 校验通过","evidence":["docs/stage0/ci/pr6-d1-cross-repo-candidate-workflow-2026-08-21.md"]},
    {"id":"E0-16","domain":"运行时 API 契约","status":"PASS","criteria":"前端 37、运行时 60、匹配 37、缺失 0","evidence":["docs/stage0/ci/pr6-d2-c-full-stack-ai-gate-2026-08-22.md"]},
    {"id":"E0-17","domain":"AI 闭环","status":"PASS","criteria":"预览、取消、确认、幂等重放全部通过","evidence":["docs/stage0/ci/pr6-d2-c-full-stack-ai-gate-2026-08-22.md"]},
    {"id":"E0-18","domain":"业务落库计数","status":"PASS","criteria":"项目、里程碑、任务计数为 1/2/4","evidence":["docs/stage0/ci/pr6-d2-c-full-stack-ai-gate-2026-08-22.md"]},
    {"id":"E0-19","domain":"真实 AI 范围","status":"ACCEPTED_RISK","criteria":"CI 使用确定性 Stub，不代表真实模型质量验收","evidence":["docs/stage0/ci/pr6-d2-c-full-stack-ai-gate-2026-08-22.md"]},
    {"id":"E0-20","domain":"本地 Docker","status":"ACCEPTED_RISK","criteria":"本地镜像下载受限，以 GitHub Linux Runner 作为门禁证据","evidence":["docs/stage0/ci/pr6-d2-c-full-stack-ai-gate-2026-08-22.md"]},
    {"id":"E0-21","domain":"系统角色","status":"DEFERRED","criteria":"user.system_role 随 V2 迁移进入阶段 1","evidence":["docs/stage0/flyway/v1-design.md"]}
  ],
  "closingGates": [
    {"id":"E0-22","domain":"阶段 0 总验收","status":"PENDING","criteria":"所有必需项 PASS，延期和风险均有明确记录","owner":"项目负责人","requires":["D3-2 机器校验","D4 最终候选"]},
    {"id":"E0-23","domain":"阶段 0 证据封存","status":"PENDING","criteria":"最终候选、Manifest、摘要、Tag 和 Release 完整绑定","owner":"项目负责人","requires":["D4 最终候选 10/10 Job"]}
  ],
  "risks": [
    {"id":"R-001","status":"ACCEPTED_RISK","title":"本机 MySQL Root 密码未轮换","owner":"项目负责人","trigger":"发生外部暴露、凭据泄露或进入云/生产部署","mitigation":"应用和测试不使用 Root，Root 仅限 localhost，密码不进入应用环境变量","targetStage":"阶段 0 基础设施加固"},
    {"id":"R-002","status":"DEFERRED","title":"Redis 5 认证与 ACL","owner":"基础设施维护者","trigger":"Redis 进入非可信网络或升级到 Redis 6+","mitigation":"当前不纳入阶段 0；进入部署阶段前选择升级或 requirepass 方案","targetStage":"阶段 1/部署准备"},
    {"id":"R-003","status":"NOT_APPLICABLE","title":"Qdrant 当前无调用方","owner":"AI 基础设施维护者","trigger":"进入 RAG 或出现 Qdrant 代码调用方","mitigation":"当前不设置凭据、不启动 Qdrant 依赖","targetStage":"阶段 4"},
    {"id":"R-004","status":"ACCEPTED_RISK","title":"CI 使用确定性 AI Stub","owner":"AI 功能负责人","trigger":"需要验证真实模型质量、延迟、成本或供应商兼容性","mitigation":"CI 只验证应用闭环；真实模型在阶段 2/3 单独评测，凭据不进入 CI 证据","targetStage":"阶段 2/3"},
    {"id":"R-005","status":"ACCEPTED_RISK","title":"本地 Docker 环境未完成全栈启动","owner":"开发环境维护者","trigger":"需要本地离线复现完整发布门禁","mitigation":"使用固定版本 GitHub Linux Runner 完成可重复门禁，保留失败边界记录","targetStage":"开发环境治理"},
    {"id":"R-006","status":"DEFERRED","title":"系统角色与任务归属尚未进入 V1","owner":"后端与权限负责人","trigger":"开始阶段 1/V2 任务归属、周复盘和统一权限设计","mitigation":"V1 保持现有模型不变，禁止通过临时字段绕过 V2 设计","targetStage":"阶段 1/V2"}
  ],
  "summary": {
    "pass": 15,
    "acceptedRisk": 3,
    "deferred": 2,
    "notApplicable": 1,
    "fail": 0,
    "pending": 2
  },
  "policy": {
    "requiredFailureCount": 0,
    "unclassifiedCount": 0,
    "allowedResidualStatuses": ["ACCEPTED_RISK", "DEFERRED", "NOT_APPLICABLE"],
    "mainDatabaseTouchedByD3": false,
    "publishedFlywayV1ModifiedByD3": false
  },
  "finalSeal": {
    "status": "PENDING",
    "requiresFinalCandidate": true,
    "requiresManifestSha256": true,
    "requiresAnnotatedTag": true,
    "requiresGitHubRelease": true
  }
}
